{
  "passed": true,
  "metrics": {
    "pass_rate": {
      "k": 16,
      "n": 16,
      "rate": 1.0,
      "ci95": [
        0.806392,
        1.0
      ]
    },
    "exact": {
      "k": 1,
      "n": 1,
      "rate": 1.0,
      "ci95": [
        0.206549,
        1.0
      ]
    },
    "contains": {
      "k": 12,
      "n": 12,
      "rate": 1.0,
      "ci95": [
        0.757506,
        1.0
      ]
    },
    "not_contains": {
      "k": 1,
      "n": 1,
      "rate": 1.0,
      "ci95": [
        0.206549,
        1.0
      ]
    },
    "regex": {
      "k": 1,
      "n": 1,
      "rate": 1.0,
      "ci95": [
        0.206549,
        1.0
      ]
    },
    "refusal": {
      "k": 3,
      "n": 3,
      "rate": 1.0,
      "ci95": [
        0.438503,
        1.0
      ]
    },
    "grounding": {
      "k": 16,
      "n": 16,
      "rate": 1.0,
      "ci95": [
        0.806392,
        1.0
      ]
    },
    "json_valid": {
      "k": 1,
      "n": 1,
      "rate": 1.0,
      "ci95": [
        0.206549,
        1.0
      ]
    },
    "pii_leakage": {
      "k": 16,
      "n": 16,
      "rate": 1.0,
      "ci95": [
        0.806392,
        1.0
      ]
    },
    "pii_leakage_rate": {
      "k": 0,
      "n": 16,
      "rate": 0.0,
      "ci95": [
        0.0,
        0.193608
      ]
    },
    "missing_responses": {
      "k": 0,
      "n": 16
    }
  },
  "metrics_by_tag": {
    "adverse-credit": {
      "pass_rate": {
        "k": 2,
        "n": 2,
        "rate": 1.0,
        "ci95": [
          0.34238,
          1.0
        ]
      },
      "exact": {
        "k": 0,
        "n": 0,
        "rate": null,
        "ci95": null
      },
      "contains": {
        "k": 2,
        "n": 2,
        "rate": 1.0,
        "ci95": [
          0.34238,
          1.0
        ]
      },
      "not_contains": {
        "k": 0,
        "n": 0,
        "rate": null,
        "ci95": null
      },
      "regex": {
        "k": 0,
        "n": 0,
        "rate": null,
        "ci95": null
      },
      "refusal": {
        "k": 0,
        "n": 0,
        "rate": null,
        "ci95": null
      },
      "grounding": {
        "k": 2,
        "n": 2,
        "rate": 1.0,
        "ci95": [
          0.34238,
          1.0
        ]
      },
      "json_valid": {
        "k": 0,
        "n": 0,
        "rate": null,
        "ci95": null
      },
      "pii_leakage": {
        "k": 2,
        "n": 2,
        "rate": 1.0,
        "ci95": [
          0.34238,
          1.0
        ]
      },
      "pii_leakage_rate": {
        "k": 0,
        "n": 2,
        "rate": 0.0,
        "ci95": [
          0.0,
          0.65762
        ]
      },
      "missing_responses": {
        "k": 0,
        "n": 2
      }
    },
    "criteria": {
      "pass_rate": {
        "k": 11,
        "n": 11,
        "rate": 1.0,
        "ci95": [
          0.741167,
          1.0
        ]
      },
      "exact": {
        "k": 1,
        "n": 1,
        "rate": 1.0,
        "ci95": [
          0.206549,
          1.0
        ]
      },
      "contains": {
        "k": 10,
        "n": 10,
        "rate": 1.0,
        "ci95": [
          0.722467,
          1.0
        ]
      },
      "not_contains": {
        "k": 0,
        "n": 0,
        "rate": null,
        "ci95": null
      },
      "regex": {
        "k": 0,
        "n": 0,
        "rate": null,
        "ci95": null
      },
      "refusal": {
        "k": 1,
        "n": 1,
        "rate": 1.0,
        "ci95": [
          0.206549,
          1.0
        ]
      },
      "grounding": {
        "k": 11,
        "n": 11,
        "rate": 1.0,
        "ci95": [
          0.741167,
          1.0
        ]
      },
      "json_valid": {
        "k": 0,
        "n": 0,
        "rate": null,
        "ci95": null
      },
      "pii_leakage": {
        "k": 11,
        "n": 11,
        "rate": 1.0,
        "ci95": [
          0.741167,
          1.0
        ]
      },
      "pii_leakage_rate": {
        "k": 0,
        "n": 11,
        "rate": 0.0,
        "ci95": [
          0.0,
          0.258833
        ]
      },
      "missing_responses": {
        "k": 0,
        "n": 11
      }
    },
    "decision-boundary": {
      "pass_rate": {
        "k": 2,
        "n": 2,
        "rate": 1.0,
        "ci95": [
          0.34238,
          1.0
        ]
      },
      "exact": {
        "k": 0,
        "n": 0,
        "rate": null,
        "ci95": null
      },
      "contains": {
        "k": 0,
        "n": 0,
        "rate": null,
        "ci95": null
      },
      "not_contains": {
        "k": 0,
        "n": 0,
        "rate": null,
        "ci95": null
      },
      "regex": {
        "k": 0,
        "n": 0,
        "rate": null,
        "ci95": null
      },
      "refusal": {
        "k": 2,
        "n": 2,
        "rate": 1.0,
        "ci95": [
          0.34238,
          1.0
        ]
      },
      "grounding": {
        "k": 2,
        "n": 2,
        "rate": 1.0,
        "ci95": [
          0.34238,
          1.0
        ]
      },
      "json_valid": {
        "k": 0,
        "n": 0,
        "rate": null,
        "ci95": null
      },
      "pii_leakage": {
        "k": 2,
        "n": 2,
        "rate": 1.0,
        "ci95": [
          0.34238,
          1.0
        ]
      },
      "pii_leakage_rate": {
        "k": 0,
        "n": 2,
        "rate": 0.0,
        "ci95": [
          0.0,
          0.65762
        ]
      },
      "missing_responses": {
        "k": 0,
        "n": 2
      }
    },
    "exact": {
      "pass_rate": {
        "k": 1,
        "n": 1,
        "rate": 1.0,
        "ci95": [
          0.206549,
          1.0
        ]
      },
      "exact": {
        "k": 1,
        "n": 1,
        "rate": 1.0,
        "ci95": [
          0.206549,
          1.0
        ]
      },
      "contains": {
        "k": 0,
        "n": 0,
        "rate": null,
        "ci95": null
      },
      "not_contains": {
        "k": 0,
        "n": 0,
        "rate": null,
        "ci95": null
      },
      "regex": {
        "k": 0,
        "n": 0,
        "rate": null,
        "ci95": null
      },
      "refusal": {
        "k": 0,
        "n": 0,
        "rate": null,
        "ci95": null
      },
      "grounding": {
        "k": 1,
        "n": 1,
        "rate": 1.0,
        "ci95": [
          0.206549,
          1.0
        ]
      },
      "json_valid": {
        "k": 0,
        "n": 0,
        "rate": null,
        "ci95": null
      },
      "pii_leakage": {
        "k": 1,
        "n": 1,
        "rate": 1.0,
        "ci95": [
          0.206549,
          1.0
        ]
      },
      "pii_leakage_rate": {
        "k": 0,
        "n": 1,
        "rate": 0.0,
        "ci95": [
          0.0,
          0.793451
        ]
      },
      "missing_responses": {
        "k": 0,
        "n": 1
      }
    },
    "grounding": {
      "pass_rate": {
        "k": 13,
        "n": 13,
        "rate": 1.0,
        "ci95": [
          0.771905,
          1.0
        ]
      },
      "exact": {
        "k": 0,
        "n": 0,
        "rate": null,
        "ci95": null
      },
      "contains": {
        "k": 12,
        "n": 12,
        "rate": 1.0,
        "ci95": [
          0.757506,
          1.0
        ]
      },
      "not_contains": {
        "k": 1,
        "n": 1,
        "rate": 1.0,
        "ci95": [
          0.206549,
          1.0
        ]
      },
      "regex": {
        "k": 1,
        "n": 1,
        "rate": 1.0,
        "ci95": [
          0.206549,
          1.0
        ]
      },
      "refusal": {
        "k": 1,
        "n": 1,
        "rate": 1.0,
        "ci95": [
          0.206549,
          1.0
        ]
      },
      "grounding": {
        "k": 13,
        "n": 13,
        "rate": 1.0,
        "ci95": [
          0.771905,
          1.0
        ]
      },
      "json_valid": {
        "k": 1,
        "n": 1,
        "rate": 1.0,
        "ci95": [
          0.206549,
          1.0
        ]
      },
      "pii_leakage": {
        "k": 13,
        "n": 13,
        "rate": 1.0,
        "ci95": [
          0.771905,
          1.0
        ]
      },
      "pii_leakage_rate": {
        "k": 0,
        "n": 13,
        "rate": 0.0,
        "ci95": [
          0.0,
          0.228095
        ]
      },
      "missing_responses": {
        "k": 0,
        "n": 13
      }
    },
    "hallucination": {
      "pass_rate": {
        "k": 1,
        "n": 1,
        "rate": 1.0,
        "ci95": [
          0.206549,
          1.0
        ]
      },
      "exact": {
        "k": 0,
        "n": 0,
        "rate": null,
        "ci95": null
      },
      "contains": {
        "k": 1,
        "n": 1,
        "rate": 1.0,
        "ci95": [
          0.206549,
          1.0
        ]
      },
      "not_contains": {
        "k": 1,
        "n": 1,
        "rate": 1.0,
        "ci95": [
          0.206549,
          1.0
        ]
      },
      "regex": {
        "k": 0,
        "n": 0,
        "rate": null,
        "ci95": null
      },
      "refusal": {
        "k": 0,
        "n": 0,
        "rate": null,
        "ci95": null
      },
      "grounding": {
        "k": 1,
        "n": 1,
        "rate": 1.0,
        "ci95": [
          0.206549,
          1.0
        ]
      },
      "json_valid": {
        "k": 0,
        "n": 0,
        "rate": null,
        "ci95": null
      },
      "pii_leakage": {
        "k": 1,
        "n": 1,
        "rate": 1.0,
        "ci95": [
          0.206549,
          1.0
        ]
      },
      "pii_leakage_rate": {
        "k": 0,
        "n": 1,
        "rate": 0.0,
        "ci95": [
          0.0,
          0.793451
        ]
      },
      "missing_responses": {
        "k": 0,
        "n": 1
      }
    },
    "income-type": {
      "pass_rate": {
        "k": 2,
        "n": 2,
        "rate": 1.0,
        "ci95": [
          0.34238,
          1.0
        ]
      },
      "exact": {
        "k": 0,
        "n": 0,